Frame 18: 1103 bytes on wire (8824 bits), 1103 bytes captured (8824 bits) on interface 0
    Interface id: 0
    WTAP_ENCAP: 1
    Arrival Time: Dec 21, 2012 16:07:11.128551000 EST
    [Time shift for this packet: 0.000000000 seconds]
    Epoch Time: 1356066431.128551000 seconds
    [Time delta from previous captured frame: 0.134116000 seconds]
    [Time delta from previous displayed frame: 0.000000000 seconds]
    [Time since reference or first frame: 3.413523000 seconds]
    Frame Number: 18
    Frame Length: 1103 bytes (8824 bits)
    Capture Length: 1103 bytes (8824 bits)
    [Frame is marked: False]
    [Frame is ignored: False]
    [Protocols in frame: eth:ip:tcp:http:xml]
Ethernet II, Src: Intel_3b:a6:5e (00:02:b3:3b:a6:5e), Dst: Netgear_57:0e:53 (00:24:b2:57:0e:53)
    Destination: Netgear_57:0e:53 (00:24:b2:57:0e:53)
        Address: Netgear_57:0e:53 (00:24:b2:57:0e:53)
        .... ..0. .... .... .... .... = LG bit: Globally unique address (factory default)
        .... ...0 .... .... .... .... = IG bit: Individual address (unicast)
    Source: Intel_3b:a6:5e (00:02:b3:3b:a6:5e)
        Address: Intel_3b:a6:5e (00:02:b3:3b:a6:5e)
        .... ..0. .... .... .... .... = LG bit: Globally unique address (factory default)
        .... ...0 .... .... .... .... = IG bit: Individual address (unicast)
    Type: IP (0x0800)
Internet Protocol Version 4, Src: 10.0.0.25 (10.0.0.25), Dst: 144.132.130.126 (144.132.130.126)
    Version: 4
    Header length: 20 bytes
    Differentiated Services Field: 0x00 (DSCP 0x00: Default; ECN: 0x00: Not-ECT (Not ECN-Capable Transport))
        0000 00.. = Differentiated Services Codepoint: Default (0x00)
        .... ..00 = Explicit Congestion Notification: Not-ECT (Not ECN-Capable Transport) (0x00)
    Total Length: 1089
    Identification: 0x1a6a (6762)
    Flags: 0x02 (Don't Fragment)
        0... .... = Reserved bit: Not set
        .1.. .... = Don't fragment: Set
        ..0. .... = More fragments: Not set
    Fragment offset: 0
    Time to live: 64
    Protocol: TCP (6)
    Header checksum: 0xff31 [correct]
        [Good: True]
        [Bad: False]
    Source: 10.0.0.25 (10.0.0.25)
    Destination: 144.132.130.126 (144.132.130.126)
Transmission Control Protocol, Src Port: http (80), Dst Port: 53790 (53790), Seq: 1, Ack: 680, Len: 1037
    Source port: http (80)
    Destination port: 53790 (53790)
    [Stream index: 3]
    Sequence number: 1    (relative sequence number)
    [Next sequence number: 1038    (relative sequence number)]
    Acknowledgment number: 680    (relative ack number)
    Header length: 32 bytes
    Flags: 0x018 (PSH, ACK)
        000. .... .... = Reserved: Not set
        ...0 .... .... = Nonce: Not set
        .... 0... .... = Congestion Window Reduced (CWR): Not set
        .... .0.. .... = ECN-Echo: Not set
        .... ..0. .... = Urgent: Not set
        .... ...1 .... = Acknowledgment: Set
        .... .... 1... = Push: Set
        .... .... .0.. = Reset: Not set
        .... .... ..0. = Syn: Not set
        .... .... ...0 = Fin: Not set
    Window size value: 1034
    [Calculated window size: 16544]
    [Window size scaling factor: 16]
    Checksum: 0xa405 [validation disabled]
        [Good Checksum: False]
        [Bad Checksum: False]
    Options: (12 bytes), No-Operation (NOP), No-Operation (NOP), Timestamps
        No-Operation (NOP)
            Type: 1
                0... .... = Copy on fragmentation: No
                .00. .... = Class: Control (0)
                ...0 0001 = Number: No-Operation (NOP) (1)
        No-Operation (NOP)
            Type: 1
                0... .... = Copy on fragmentation: No
                .00. .... = Class: Control (0)
                ...0 0001 = Number: No-Operation (NOP) (1)
        Timestamps: TSval 2333834392, TSecr 4229897
            Kind: Timestamp (8)
            Length: 10
            Timestamp value: 2333834392
            Timestamp echo reply: 4229897
    [SEQ/ACK analysis]
        [Bytes in flight: 1038]
Hypertext Transfer Protocol
    HTTP/1.1 200 OK\r\n
        [Expert Info (Chat/Sequence): HTTP/1.1 200 OK\r\n]
            [Message: HTTP/1.1 200 OK\r\n]
            [Severity level: Chat]
            [Group: Sequence]
        Request Version: HTTP/1.1
        Status Code: 200
        Response Phrase: OK
    Date: Fri, 21 Dec 2012 05:07:10 GMT\r\n
    Server: Apache\r\n
    X-Content-Type-Options: nosniff\r\n
    X-Powered-By: Dragonfly CMS using PHP engine\r\n
    Content-Encoding: gzip\r\n
    Expires: Thu, 19 Nov 1981 08:52:00 GMT\r\n
    Cache-Control: no-store, no-cache, must-revalidate, post-check=0, pre-check=0\r\n
    Pragma: no-cache\r\n
    Vary: Accept-Encoding\r\n
    Content-Length: 585\r\n
        [Content length: 585]
    Keep-Alive: timeout=15, max=100\r\n
    Connection: Keep-Alive\r\n
    Content-Type: text/xml; charset=UTF-8\r\n
    \r\n
    Content-encoded entity body (gzip): 585 bytes -> 3533 bytes
eXtensible Markup Language
    <?xml
        version="1.0"
        encoding="UTF-8"
        ?>
    <methodResponse>
        <params>
            <param>
                <value>
                    <struct>
                        <member>
                            <name>
                                total_topic_num
                                </name>
                            <value>
                                <int>
                                    3
                                    </int>
                                </value>
                            </member>
                        <member>
                            <name>
                                forum_id
                                </name>
                            <value>
                                <string>
                                    3
                                    </string>
                                </value>
                            </member>
                        <member>
                            <name>
                                forum_name
                                </name>
                            <value>
                                <base64>
                                    WWFtYWhh
                                    </base64>
                                </value>
                            </member>
                        <member>
                            <name>
                                topics
                                </name>
                            <value>
                                <array>
                                    <data>
                                        <value>
                                            <struct>
                                                <member>
                                                    <name>
                                                        forum_id
                                                        </name>
                                                    <value>
                                                        <string>
                                                            3
                                                            </string>
                                                        </value>
                                                    </member>
                                                <member>
                                                    <name>
                                                        topic_id
                                                        </name>
                                                    <value>
                                                        <string>
                                                            462
                                                            </string>
                                                        </value>
                                                    </member>
                                                <member>
                                                    <name>
                                                        topic_title
                                                        </name>
                                                    <value>
                                                        <base64>
                                                            Q2hlYXAgR2VudWluZSBQV0syOA==
                                                            </base64>
                                                        </value>
                                                    </member>
                                                <member>
                                                    <name>
                                                        topic_author_id
                                                        </name>
                                                    <value>
                                                        <string>
                                                            2
                                                            </string>
                                                        </value>
                                                    </member>
                                                <member>
                                                    <name>
                                                        topic_author_name
                                                        </name>
                                                    <value>
                                                        <base64>
                                                            aHlicmlk
                                                            </base64>
                                                        </value>
                                                    </member>
                                                <member>
                                                    <name>
                                                        last_reply_time
                                                        </name>
                                                    <value>
                                                        <dateTime.iso8601>
                                                            20110831T18:45:29+00:00
                                                            </dateTime.iso8601>
                                                        </value>
                                                    </member>
                                                <member>
                                                    <name>
                                                        reply_number
                                                        </name>
                                                    <value>
                                                        <int>
                                                            0
                                                            </int>
                                                        </value>
                                                    </member>
                                                <member>
                                                    <name>
                                                        view_number
                                                        </name>
                                                    <value>
                                                        <int>
                                                            0
                                                            </int>
                                                        </value>
                                                    </member>
                                                <member>
                                                    <name>
                                                        short_content
                                                        </name>
                                                    <value>
                                                        <base64>
                                                            </base64>
                                                        </value>
                                                    </member>
                                                <member>
                                                    <name>
                                                        new_post
                                                        </name>
                                                    <value>
                                                        <boolean>
                                                            1
                                                            </boolean>
                                                        </value>
                                                    </member>
                                                <member>
                                                    <name>
                                                        icon_url
                                                        </name>
                                                    <value>
                                                        <string>
                                                            http://www.2strokesdownunder.com/images/avatars/gallery/blank.gif
                                                            </string>
                                                        </value>
                                                    </member>
                                                </struct>
                                            </value>
                                        <value>
                                            <struct>
                                                <member>
                                                    <name>
                                                        forum_id
                                                        </name>
                                                    <value>
                                                        <string>
                                                            3
                                                            </string>
                                                        </value>
                                                    </member>
                                                <member>
                                                    <name>
                                                        topic_id
                                                        </name>
                                                    <value>
                                                        <string>
                                                            80
                                                            </string>
                                                        </value>
                                                    </member>
                                                <member>
                                                    <name>
                                                        topic_title
                                                        </name>
                                                    <value>
                                                        <base64>
                                                            ODEgUkQvTEMgTWljcm9maWNoZQ==
                                                            </base64>
                                                        </value>
                                                    </member>
                                                <member>
                                                    <name>
                                                        topic_author_id
                                                        </name>
                                                    <value>
                                                        <string>
                                                            2
                                                            </string>
                                                        </value>
                                                    </member>
                                                <member>
                                                    <name>
                                                        topic_author_name
                                                        </name>
                                                    <value>
                                                        <base64>
                                                            aHlicmlk
                                                            </base64>
                                                        </value>
                                                    </member>
                                                <member>
                                                    <name>
                                                        last_reply_time
                                                        </name>
                                                    <value>
                                                        <dateTime.iso8601>
                                                            20100122T00:51:16+00:00
                                                            </dateTime.iso8601>
                                                        </value>
                                                    </member>
                                                <member>
                                                    <name>
                                                        reply_number
                                                        </name>
                                                    <value>
                                                        <int>
                                                            0
                                                            </int>
                                                        </value>
                                                    </member>
                                                <member>
                                                    <name>
                                                        view_number
                                                        </name>
                                                    <value>
                                                        <int>
                                                            0
                                                            </int>
                                                        </value>
                                                    </member>
                                                <member>
                                                    <name>
                                                        short_content
                                                        </name>
                                                    <value>
                                                        <base64>
                                                            </base64>
                                                        </value>
                                                    </member>
                                                <member>
                                                    <name>
                                                        new_post
                                                        </name>
                                                    <value>
                                                        <boolean>
                                                            1
                                                            </boolean>
                                                        </value>
                                                    </member>
                                                <member>
                                                    <name>
                                                        icon_url
                                                        </name>
                                                    <value>
                                                        <string>
                                                            http://www.2strokesdownunder.com/images/avatars/gallery/blank.gif
                                                            </string>
                                                        </value>
                                                    </member>
                                                </struct>
                                            </value>
                                        <value>
                                            <struct>
                                                <member>
                                                    <name>
                                                        forum_id
                                                        </name>
                                                    <value>
                                                        <string>
                                                            3
                                                            </string>
                                                        </value>
                                                    </member>
                                                <member>
                                                    <name>
                                                        topic_id
                                                        </name>
                                                    <value>
                                                        <string>
                                                            73
                                                            </string>
                                                        </value>
                                                    </member>
                                                <member>
                                                    <name>
                                                        topic_title
                                                        </name>
                                                    <value>
                                                        <base64>
                                                            Ulo1MDAgRmljaGUsIFNlcnZpY2UgJiBUdW5pbmcgTWFudWFscw==
                                                            </base64>
                                                        </value>
                                                    </member>
                                                <member>
                                                    <name>
                                                        topic_author_id
                                                        </name>
                                                    <value>
                                                        <string>
                                                            2
                                                            </string>
                                                        </value>
                                                    </member>
                                                <member>
                                                    <name>
                                                        topic_author_name
                                                        </name>
                                                    <value>
                                                        <base64>
                                                            aHlicmlk
                                                            </base64>
                                                        </value>
                                                    </member>
                                                <member>
                                                    <name>
                                                        last_reply_time
                                                        </name>
                                                    <value>
                                                        <dateTime.iso8601>
                                                            20100118T21:30:02+00:00
                                                            </dateTime.iso8601>
                                                        </value>
                                                    </member>
                                                <member>
                                                    <name>
                                                        reply_number
                                                        </name>
                                                    <value>
                                                        <int>
                                                            0
                                                            </int>
                                                        </value>
                                                    </member>
                                                <member>
                                                    <name>
                                                        view_number
                                                        </name>
                                                    <value>
                                                        <int>
                                                            0
                                                            </int>
                                                        </value>
                                                    </member>
                                                <member>
                                                    <name>
                                                        short_content
                                                        </name>
                                                    <value>
                                                        <base64>
                                                            </base64>
                                                        </value>
                                                    </member>
                                                <member>
                                                    <name>
                                                        new_post
                                                        </name>
                                                    <value>
                                                        <boolean>
                                                            1
                                                            </boolean>
                                                        </value>
                                                    </member>
                                                <member>
                                                    <name>
                                                        icon_url
                                                        </name>
                                                    <value>
                                                        <string>
                                                            http://www.2strokesdownunder.com/images/avatars/gallery/blank.gif
                                                            </string>
                                                        </value>
                                                    </member>
                                                </struct>
                                            </value>
                                        </data>
                                    </array>
                                </value>
                            </member>
                        </struct>
                    </value>
                </param>
            </params>
        </methodResponse>

Frame 34: 1348 bytes on wire (10784 bits), 1348 bytes captured (10784 bits) on interface 0
    Interface id: 0
    WTAP_ENCAP: 1
    Arrival Time: Dec 21, 2012 16:07:12.066632000 EST
    [Time shift for this packet: 0.000000000 seconds]
    Epoch Time: 1356066432.066632000 seconds
    [Time delta from previous captured frame: 0.000070000 seconds]
    [Time delta from previous displayed frame: 0.938081000 seconds]
    [Time since reference or first frame: 4.351604000 seconds]
    Frame Number: 34
    Frame Length: 1348 bytes (10784 bits)
    Capture Length: 1348 bytes (10784 bits)
    [Frame is marked: False]
    [Frame is ignored: False]
    [Protocols in frame: eth:ip:tcp:http:xml]
Ethernet II, Src: Intel_3b:a6:5e (00:02:b3:3b:a6:5e), Dst: Netgear_57:0e:53 (00:24:b2:57:0e:53)
    Destination: Netgear_57:0e:53 (00:24:b2:57:0e:53)
        Address: Netgear_57:0e:53 (00:24:b2:57:0e:53)
        .... ..0. .... .... .... .... = LG bit: Globally unique address (factory default)
        .... ...0 .... .... .... .... = IG bit: Individual address (unicast)
    Source: Intel_3b:a6:5e (00:02:b3:3b:a6:5e)
        Address: Intel_3b:a6:5e (00:02:b3:3b:a6:5e)
        .... ..0. .... .... .... .... = LG bit: Globally unique address (factory default)
        .... ...0 .... .... .... .... = IG bit: Individual address (unicast)
    Type: IP (0x0800)
Internet Protocol Version 4, Src: 10.0.0.25 (10.0.0.25), Dst: 144.132.130.126 (144.132.130.126)
    Version: 4
    Header length: 20 bytes
    Differentiated Services Field: 0x00 (DSCP 0x00: Default; ECN: 0x00: Not-ECT (Not ECN-Capable Transport))
        0000 00.. = Differentiated Services Codepoint: Default (0x00)
        .... ..00 = Explicit Congestion Notification: Not-ECT (Not ECN-Capable Transport) (0x00)
    Total Length: 1334
    Identification: 0x7057 (28759)
    Flags: 0x02 (Don't Fragment)
        0... .... = Reserved bit: Not set
        .1.. .... = Don't fragment: Set
        ..0. .... = More fragments: Not set
    Fragment offset: 0
    Time to live: 64
    Protocol: TCP (6)
    Header checksum: 0xa84f [correct]
        [Good: True]
        [Bad: False]
    Source: 10.0.0.25 (10.0.0.25)
    Destination: 144.132.130.126 (144.132.130.126)
Transmission Control Protocol, Src Port: http (80), Dst Port: 45114 (45114), Seq: 10081, Ack: 605, Len: 1282
    Source port: http (80)
    Destination port: 45114 (45114)
    [Stream index: 4]
    Sequence number: 10081    (relative sequence number)
    [Next sequence number: 11363    (relative sequence number)]
    Acknowledgment number: 605    (relative ack number)
    Header length: 32 bytes
    Flags: 0x018 (PSH, ACK)
        000. .... .... = Reserved: Not set
        ...0 .... .... = Nonce: Not set
        .... 0... .... = Congestion Window Reduced (CWR): Not set
        .... .0.. .... = ECN-Echo: Not set
        .... ..0. .... = Urgent: Not set
        .... ...1 .... = Acknowledgment: Set
        .... .... 1... = Push: Set
        .... .... .0.. = Reset: Not set
        .... .... ..0. = Syn: Not set
        .... .... ...0 = Fin: Not set
    Window size value: 1034
    [Calculated window size: 16544]
    [Window size scaling factor: 16]
    Checksum: 0xe603 [validation disabled]
        [Good Checksum: False]
        [Bad Checksum: False]
    Options: (12 bytes), No-Operation (NOP), No-Operation (NOP), Timestamps
        No-Operation (NOP)
            Type: 1
                0... .... = Copy on fragmentation: No
                .00. .... = Class: Control (0)
                ...0 0001 = Number: No-Operation (NOP) (1)
        No-Operation (NOP)
            Type: 1
                0... .... = Copy on fragmentation: No
                .00. .... = Class: Control (0)
                ...0 0001 = Number: No-Operation (NOP) (1)
        Timestamps: TSval 2333835330, TSecr 4229897
            Kind: Timestamp (8)
            Length: 10
            Timestamp value: 2333835330
            Timestamp echo reply: 4229897
    [SEQ/ACK analysis]
        [Bytes in flight: 11363]
    TCP segment data (1282 bytes)
[8 Reassembled TCP Segments (11362 bytes): #27(1440), #28(1440), #29(1440), #30(1440), #31(1440), #32(1440), #33(1440), #34(1282)]
    [Frame: 27, payload: 0-1439 (1440 bytes)]
    [Frame: 28, payload: 1440-2879 (1440 bytes)]
    [Frame: 29, payload: 2880-4319 (1440 bytes)]
    [Frame: 30, payload: 4320-5759 (1440 bytes)]
    [Frame: 31, payload: 5760-7199 (1440 bytes)]
    [Frame: 32, payload: 7200-8639 (1440 bytes)]
    [Frame: 33, payload: 8640-10079 (1440 bytes)]
    [Frame: 34, payload: 10080-11361 (1282 bytes)]
    [Segment count: 8]
    [Reassembled TCP length: 11362]
Hypertext Transfer Protocol
    HTTP/1.1 200 OK\r\n
        [Expert Info (Chat/Sequence): HTTP/1.1 200 OK\r\n]
            [Message: HTTP/1.1 200 OK\r\n]
            [Severity level: Chat]
            [Group: Sequence]
        Request Version: HTTP/1.1
        Status Code: 200
        Response Phrase: OK
    Date: Fri, 21 Dec 2012 05:07:10 GMT\r\n
    Server: Apache\r\n
    X-Content-Type-Options: nosniff\r\n
    X-Powered-By: Dragonfly CMS using PHP engine\r\n
    Content-Encoding: gzip\r\n
    Expires: Thu, 19 Nov 1981 08:52:00 GMT\r\n
    Cache-Control: no-store, no-cache, must-revalidate, post-check=0, pre-check=0\r\n
    Pragma: no-cache\r\n
    Vary: Accept-Encoding\r\n
    Content-Length: 10908\r\n
        [Content length: 10908]
    Keep-Alive: timeout=15, max=100\r\n
    Connection: Keep-Alive\r\n
    Content-Type: text/xml; charset=UTF-8\r\n
    \r\n
    Content-encoded entity body (gzip): 10908 bytes -> 223808 bytes
eXtensible Markup Language
    <?xml
        version="1.0"
        encoding="UTF-8"
        ?>
    <methodResponse>
        <params>
            <param>
                <value>
                    <struct>
                        <member>
                            <name>
                                total_topic_num
                                </name>
                            <value>
                                <int>
                                    0
                                    </int>
                                </value>
                            </member>
                        <member>
                            <name>
                                forum_id
                                </name>
                            <value>
                                <string>
                                    3
                                    </string>
                                </value>
                            </member>
                        <member>
                            <name>
                                forum_name
                                </name>
                            <value>
                                <base64>
                                    WWFtYWhh
                                    </base64>
                                </value>
                            </member>
                        <member>
                            <name>
                                topics
                                </name>
                            <value>
                                <array>
                                    <data>
                                        <value>
                                            <struct>
                                                <member>
                                                    <name>
                                                        forum_id
                                                        </name>
                                                    <value>
                                                        <string>
                                                            3
                                                            </string>
                                                        </value>
                                                    </member>
                                                <member>
                                                    <name>
                                                        topic_id
                                                        </name>
                                                    <value>
                                                        <string>
                                                            868
                                                            </string>
                                                        </value>
                                                    </member>
                                                <member>
                                                    <name>
                                                        topic_title
                                                        </name>
                                                    <value>
                                                        <base64>
                                                            WWFtbXkgUloyNTA=
                                                            </base64>
                                                        </value>
                                                    </member>
                                                <member>
                                                    <name>
                                                        topic_author_id
                                                        </name>
                                                    <value>
                                                        <string>
                                                            293
                                                            </string>
                                                        </value>
                                                    </member>
                                                <member>
                                                    <name>
                                                        topic_author_name
                                                        </name>
                                                    <value>
                                                        <base64>
                                                            U3RhbmtmbGFwcGVy
                                                            </base64>
                                                        </value>
                                                    </member>
                                                <member>
                                                    <name>
                                                        last_reply_time
                                                        </name>
                                                    <value>
                                                        <dateTime.iso8601>
                                                            20121219T06:49:19+00:00
                                                            </dateTime.iso8601>
                                                        </value>
                                                    </member>
                                                <member>
                                                    <name>
